<!ELEMENT coagulate (smallmode+)>
<!ELEMENT smallmode (nmodes, bigmode+)>
<!ATTLIST smallmode
  id  ID  #REQUIRED
>
<!ELEMENT nmodes (#PCDATA)>
<!ATTLIST nmodes
  type CDATA #REQUIRED
>
<!ELEMENT bigmode (#PCDATA)>
<!ATTLIST bigmode
  id  CDATA  #REQUIRED
  type  CDATA #REQUIRED
>
