<?xml version="1.0" encoding="UTF-8"?>
<!DOCTYPE coagulate SYSTEM "coagulate.dtd">

<coagulate>
  <smallmode id="sol_ait">
    <nmodes type="int">3</nmodes>
    <bigmode id="sol_ait" type="char">sol_ait</bigmode>
    <bigmode id="sol_acc" type="char">sol_acc</bigmode>
    <bigmode id="sol_coa" type="char">sol_coa</bigmode>
  </smallmode>
  <smallmode id="sol_acc">
    <nmodes type="int">2</nmodes>
    <bigmode id="sol_acc" type="char">sol_acc</bigmode>
    <bigmode id="sol_coa" type="char">sol_coa</bigmode>
  </smallmode>
  <smallmode id="sol_coa">
    <nmodes type="int">1</nmodes>
    <bigmode id="sol_coa" type="char">sol_coa</bigmode>
  </smallmode>
</coagulate>
